country,city,address_1,reason_for_recall,address_2,product_quantity,code_info,center_classification_date,distribution_pattern,state,product_description,report_date,classification,openfda,recalling_firm,recall_number,initial_firm_notification,product_type,event_id,more_code_info,recall_initiation_date,postal_code,voluntary_mandated,status,severity_score
United States,Wadena,266 4th St NE,Products are being recalled because they may have the potential to be contaminated with Listeria monocytogenes,,1000 units,"UPC 795631817478, Sell by 10/13/19 to 11/02/19",20191211,"The firm distributed products to foodservice establishments and retailers in IA, IL, IN, MI, MN, MT, ND, NE, SD, WI, WY.",MN,"Broccoli Salad Kit V, Large white generic label with Small White label, packaged in a plastic bag.  Packaged for foodservice for deli",20191127,Class I,{},"Russ Davis Wholesale, Inc.",F-0314-2020,"Two or more of the following: Email, Fax, Letter, Press Release, Telephone, Visit",Food,84222,20200611.0,20191105,56482-1205,Voluntary: Firm initiated,Terminated,5
United States,Austin,1807 W Slaughter Ln Ste 495,Potential undeclared peanuts in cumin ingredient.,,3176 cups,"Use by dates: 1/6/2015, 1/12/2015, 1/20/2015, 1/27/2015, 2/8/2015",20150205,Nationwide,TX,Hummus; All-natural ZILKS HATCH GREEN CHILI  HUMMUS GLUTEN FREE & NON-GMO NET WT. 8 OZ,20150211,Class II,{},Zilks Foods,F-0972-2015,Letter,Food,70182,20150724.0,20150101,78748-6230,Voluntary: Firm initiated,Terminated,3
United States,Miami,4001 Nw 31st Ave,Possible contamination with E. coli O157,,"Approx. 43,776 portion cups, 16,000 sandwiches, 1,120 lb in various sized repackaged containers",Product Code 8491. No expiration date,20170414,Product is distributed throughout Florida to child care programs and after school programs for children.,FL,"Pan Pita with soynut butter spread on top, 4"" pita. Manufactured by Greater Miami Caterers 4001 NW 31 Ave.,",20170426,Class I,{},"Greater Miami Caterers, Inc.",F-1949-2017,Telephone,Food,76786,20170309.0,33142-5103,Voluntary: Firm initiated,Ongoing,,5
United States,Carnegie,230 E Main St,Work out support nutritional supplements manufactured on shared equipment may contain unknown amounts of whey protein and soy.,,823,"lots PB0041615, PB0030615, UPC 0748252659002",20150605,nationwide to retailers and consumers,PA,"REACTION RECOR: Pre Action- 336g Glacier Blue, Distributed by Reaction Nutrition, Carnegie, PA",20150617,Class II,{},Reaction Nutrition LLC,F-2400-2015,Letter,Food,71095,20181121.0,20150415,15106-2700,Voluntary: Firm initiated,Terminated,3
United States,Worcester,984 Main St,Product manufactured under insanitary conditions and firm did not follow the Food Code-mandated scheduled process,,unknown,none,20170123,"Retail stores in MA, NY, NJ",MA,"ELDER PAINTSIL'S GA KENKEY, NET WT. 1.20, UPC: 6 61799 58166 0, MANUFACTURED BY  VICTORY GENERAL FOODS IN WORCESTER, MA 01603",20170201,Class II,{},Victory General Foods Inc,F-1337-2017,Telephone,Food,75096,20170124.0,20160826,01603-2417,Voluntary: Firm initiated,Terminated,3
United States,Austin,550 Bowie St,The product has the potential to be contaminated with Listeria monocytogenes.,,Unknown,"Sold between June 1 and July 21, 2014 at Whole Foods Stores",20141209,"All states where Whole Foods Market stores are located except Florida, Washington, and Oregon.",TX,"Whole Foods Market Balsamic Chicken Breast & Peaches, UPC/PLU 20254100000",20141217,Class II,{},Whole Foods Market,F-0661-2015,Press Release,Food,68897,20150519.0,20140723,78703-4648,Voluntary: Firm initiated,Terminated,3
United States,Houston,2008 W W Thorne Blvd,Potential contamination with Listeria monocytogenes.,,Unknown,Use by date range 8/12-18/2017 and Use by date range 8/12-18/2017 and Use by date range 8/13-20/2017,20170928,"Alabama, Florida, Georgia, Louisiana, and Mississippi",TX,"Vegetable Kabob, 23-oz. packaged in an overwrap; Kabob Sensations Veggie Kabob, 15-oz. packaged in am overwrap; Marketside Veggie Kabobs, 23-oz. packaged in an overwrap",20171004,Class I,{},"Country Fresh Products, LLC",F-3581-2017,"Two or more of the following: Email, Fax, Letter, Press Release, Telephone, Visit",Food,78071,20171213.0,20170902,77073-3302,Voluntary: Firm initiated,Terminated,5
United States,Waukegan,3751 Sunset Ave,Sunflower seeds purchased from SunOpta that are potentially contaminated with Listeria.,,960 lbs,Firm's product code N34B lot code L902095,20161222,"U.S. food distributors located in CA, CO, FL, GA, IA, IL, IN, KS, KY, LA, MA,	MD, MI, MO, NE, NJ, NY, OH, OK, PA, TN, TX, UT, WA and WI.",IL,"Product is packaged into a plastic bag and placed into cardboard box. Product is labeled as ""N34D SALT-FREE ROASTED SUNFLOWER SEEDS"".",20161228,Class I,{},Woodland Foods,F-0729-2017,"Two or more of the following: Email, Fax, Letter, Press Release, Telephone, Visit",Food,74231,20181031.0,20160519,60087-3213,Voluntary: Firm initiated,Terminated,5
United States,Westfield,53 Summit Lock Road,Products were not held at an appropriate temperature due to a mechanical malfunction during transportation.,53 Medieros Way,unknown,"Exact codes are unknown. The product being recalled was sold on June 17, 2019 at Target Stores in Commack, NY and Central Islip, NY.",20190724,"Two Target Stores 1. 98 Veterans Memorial Highway in Commack, New York 2. 160 North Research Place in Central Islip, New York",MA,READY PAC FOODS BISTRO SANTA FE STYLE SALAD BOWL - 6.25OZ UPC:7774529188,20190731,Class II,{},"C & S Wholesale Grocers, Inc.",F-1844-2019,Telephone,Food,83178,20190731.0,20190617,01085-9777,Voluntary: Firm initiated,Terminated,3
United States,San Antonio,1011 S Acme Rd,Product may contain undeclared peanuts.,,1344 units,Lot # 260AMR4A,20150331,"TX, LA, TN, AZ, IA",TX,"STAGECOACH SALSA CLASSIC SAN ANTONIO SALSAS MISS MICHELE'S PEACH SALSA Net Wt. 16 oz. (454g) Manufactured Exclusively for: Stagecoach Salsa Company 25011 Saddle Trail San Antonio, Texas 78255",20150408,Class II,{},"Creative Foodworks, Inc",F1843-2014,Telephone,Food,70429,20150821.0,20150202,78237-3218,Voluntary: Firm initiated,Terminated,3
United States,Prescott,111 E Elm St,Undeclared partially hydrogenated soybean oil and wheat.,,,All product on market.,20120821,Arkansas,AR,"Pineapple Pies    Case Label (side 1)  24 COUNT FRAGILE FLYWHEEL'S PIES PRESCOTT, AR Ingredients:  Cocoa, Coconut, Sugar, Butter, Vanilla, Cornstarch, Eggs    Case Label (side 2) 24 COUNT FRAGILE FLYWHEEL'S PIES PRESCOTT, AR Ingredients:  Fruit, Sugar, Butter, Almond, Salt    Pie Label:  Pineapple",20120829,Class II,{},Flywheel's Pies,F-1963-2012,Telephone,Food,62783,20151008.0,20120716,71857-2129,Voluntary: Firm initiated,Terminated,3
United States,Las Vegas,6065 Polaris Ave,Potential hazard of Clostridium botulinum toxin formation as a result of temperature abuse during storage.,,,ALL,20140922,NV only,NV,"Supreme Choice brand Jumbo Lump, 16 oz;  Premium Pasteurized Crab Meat.  Product of Thailand.  Distributed by Supreme  Lobster and Seafood Company, Villa Park, IL 60181",20141001,Class II,{},"Supreme Distributors, Inc.",F-2510-2014,Letter,Food,69150,20150401.0,20140830,89118-3100,Voluntary: Firm initiated,Terminated,3
United States,Tarpon Springs,1310 E Lake Dr,Undeclared allergen: Shrimp,,85 cases / 12 per case,Batch No. 20175; best by date: 10-13-23  Batch No. 20138; best by date: 8-26-23         Batch No. 20068; best by date: 5-5-23  Batch No. 19419; best by date: 9-19-22  Batch No. 19276; best by date: 7-10-22  Batch No. 19196; best by date: 5-30-22  Batch No. 19148; best by date: 4-17-22  Batch No. 19040 best by date: 2-6-22  Batch No. 18226; best by date: 12-1-21  Batch No. 18039; best by date: 3-1-21,20210224,"U.S distribution to the following: Springfield, MO; Crystal Lake, IL; Palisade, CO; Colorado Springs, CO; Long Lake, NY; Long Grove, IL; Sheridan, WY; Venice, FL; Pittsburgh, PA; Nassawadox, VA.",FL,"Thai Peanut Sauce, 12 fl. oz. (355ml),   UPC code #643558406919",20210303,Class I,{},Barbara's Orchard/Delicae Gourmet,F-0322-2021,Telephone,Food,87287,20210720.0,20210205,34688-8110,Voluntary: Firm initiated,Terminated,5
United States,Fredericksburg,411 S. Lincoln St,Undeclared Wheat due to a supplier's inadvertent use of a wheat product instead of whey in preparing the cheese premix for the recalling firm.,,636 units (units are glass jars;  cases contain 12 jars each for a total of  53 cases shipped.),Lot code 10364,20140609,"OH, OR",TX,"Harry & David; WILD 'N SPICY; JALAPENO TOMATO CHEESE DIP; NET WT 1 lb.; (453g);Medium;  in glass jars; MADE FOR HARRY AND DAVID, MEDFORD, OR, HARRYANDDAVID.COM; 800-547-3033",20140618,Class II,{},Fischer & Wieser Specialty Foods,F-1412-2014,Telephone,Food,67644,20150204.0,20140219,78624,Voluntary: Firm initiated,Terminated,3
United States,City Of Industry,13260 Temple Ave,Health One Pharmaceuticals is recalling dietary supplements due to significant violations of the cGMP regulations for dietary supplements.,,"320,000 units",9639,20150330,"Nationwide in US: CA, TN, WA, ID,     and worldwide:  Hong Kong, Vietnam, China, Singapore",CA,Fish Collagen,20150408,Class II,{},Health One Pharmaceuticals Inc,F-1667-2015,Letter,Food,70344,20150331.0,20150204,91746-1511,Voluntary: Firm initiated,Terminated,3
United States,Doral,2000 Nw 92nd Ave,Cumin used was contaminated with peanut protein.,,156,"UPC 4133103781, Lots: 301105 and 301125, 24 / 12 env 2.11 oz.",20150506,"US- NY, TX, FL, PA, PR, IL, VA, MA",FL,Sazon without Annatto,20150513,Class II,{},"Sazon, Inc.",F-2190-2015,E-Mail,Food,70750,20170124.0,20150126,33172-2928,Voluntary: Firm initiated,Terminated,3
United States,Clifton,1500 Main Ave,Product contains undeclared sorbic acid and undeclared sulfites (preservative),,20 cases,,20150120,NY,NJ,"Baroody Pickled Labneh with Pepper, Net Wt. 20 oz., (1 lb. 4 oz.), 575-g, in sealed glass jar, UPC 642036010549",20150128,Class III,{},Baroody Imports Inc.,F-0797-2015,Telephone,Food,70125,20160418.0,20141104,07011-2120,Voluntary: Firm initiated,Terminated,1
United States,Cleveland,8200 Madison Ave,Product contains a spice which was tested and found to contain elevated levels of lead.,,2000 lb,Item# 41251; Mfr. date/Lot# 06/17/16 & 06/27/16; Shipped 06/30/16; UPC 8 50194 41220 8; Exp. 06/17/17 & 06/27/17,20161020,"US Nationwide.  The product was distributed to the following states: IN, TX, VA",OH,National Foods Packaging Low Sodium Chicken Base in 50 lb white poly-lined paper bags,20161026,Class III,{},National Foods Packaging Inc,F-0228-2017,Letter,Food,75199,20190625.0,20160916,44102-2727,Voluntary: Firm initiated,Terminated,1
United States,Petaluma,1650 Corporate Cir,Notified by supplier of spinach that product showing the presence of Listeria Monocytogenes was erroneously shipped and used in further manufacturing of products.,,"102 cases (12 boxes per case) US, 276 International","Item number 000807; US distribution  Lot codes: 30-A265, 30-B025;    Item number 00807F- Canadian distribution;  Lot code  30-B-025.",20150602,"Nationwide and to Canada, Japan, Philippines and United Kingdom.",CA,"Amy's Gluten Free Tofu Scramble Breakfast Wraps, 5.5 oz 156 g) 12 boxes per case.  UPC: 0-42272-00807-0, US distribution only;  UPC : 0-42272-90807-3 - Canadian distribution    Amy Kitchen, Petaluma, CA",20150610,Class II,{},Amys Kitchen Inc,F-2359-2015,Press Release,Food,70806,20150805.0,20150322,94954,Voluntary: Firm initiated,Terminated,3
United States,Clifton,362 3rd St,NYSDAM Analysis has revealed the presence of undeclared sulfites in Dried Apricots.,Apt 1,61 boxes (24 containers in each case),none.,20140403,NJ,NJ,"Net Food Turkey Dried Apricots Net Weight 16.1 oz (454 g) Thunderbolt Export & Imports 743 Fairview Avenue. Suit :2 Arcadia, CA 91007 USA  UPC 8697445250019",20140409,Class I,{},Net Food Import and Export llc.,F-1744-2014,"Two or more of the following: Email, Fax, Letter, Press Release, Telephone, Visit",Food,67681,20151016.0,20140224,07011,Voluntary: Firm initiated,Terminated,5
United States,Grand Rapids,o-197 Steele st NW,"Source of whey ingredient not listed as milk, an allergen.  Consumers who have an allergy or severe sensitivity to milk run the risk of a serious or life-threatening allergic reaction if they consume these products.",,24924,expiration date between Jan 2013 and March 2016.,20130606,nationwide,MI,"All Natural Whey - Natural Flavor 1.89 LBS: Whey Protein Concentrate and Isolate, Casein/Caseinate, Nitrozyme    UPC 6-09492 72000-9 :",20130612,Class II,{},"Chemi- Source Inc, Nutra Pak",F-1478-2013,Telephone,Food,64831,20140415.0,20130402,49534-8710,Voluntary: Firm initiated,Terminated,3
United States,Forsyth,10203 State Highway 76,Firm is recalling dietary supplements containing a raw material which may contain >0.3 ppb chloramphenicol,,"6,139,669 bulk capsules","Lot #'s: 92115011, 92115012, 92115013, 92115014, 92115015, and 92115016",20131213,"Domestic distribution of the product is nationwide with direct accounts in 27 states in all geographical regions. Foreign distribution consists of direct accounts in the following countries: Canada, China, Malaysia, Norway, Slovakia, South Korea, Sweden, Taiwan, and the United Kingdom.",MO,"Bulk 9896 BIOMEDICALRESEARCH DIGE capsules, packaged in poly bags in corrugated boxes (for domestic distribution) or fiber drums (for international distribution) (SKU 92115).",20131225,Class II,{},National Enzyme Co,F-0771-2014,"Two or more of the following: Email, Fax, Letter, Press Release, Telephone, Visit",Food,66658,20150303.0,20131030,65653-5445,Voluntary: Firm initiated,Terminated,3
United States,Chicago,2501 N Keeler Ave,Product may contain undeclared milk.,,"5,000 lbs",Product #B27478; Lot #WN021517D;  WN030417E,20170817,"Nationwide, Mexico, Canada",IL,"B27478,  BATTER MIX X2, NET WT 50 LBS, Manufactured By: Newly Weds Foods, Inc., Chicago, IL 60639",20170726,Class II,{},Newly Weds Foods Inc,F-3165-2017,Letter,Food,77194,20190805.0,20170503,60639-2131,Voluntary: Firm initiated,Terminated,3
United States,Salt Lake City,440 W Lawndale Dr,Products are labeled gluten-free. A batch of flour from the raw material supplier tested positive for gluten so the firm immediately initiated a recall of the affected products.,,523 cases of 12,20223-1,20201015,"CA, CO, CT, FL, GA, TX, UT, WI. Nationwide through drop ship.",UT,"Lucky Spoon Bakery Gluten Free Chocolate Cupcakes with Vanilla Buttercream Frosting, 8.0 oz. plastic clam shell containing 4 cupcakes, UPC 8-50489-00310-4, P.O. Box 2954 Salt Lake City, UT 84110. 12 packages/case.",20201021,Class II,{},"Lucky Spoon Bakery, LLC",F-0021-2021,"Two or more of the following: Email, Fax, Letter, Press Release, Telephone, Visit",Food,86368,20210302.0,20200826,84115-2917,Voluntary: Firm initiated,Terminated,3
United States,Minneapolis,33 S 6th St,Shipping container from CA to HI was not held at proper temperature which could cause food items to be contaminated with spoilage organisms or pathogens,,2652 retail units total,"All product purchased at  Target store T2780, Honolulu, HI from March 23 through March 27, 2018.",20180503,HI,MN,Simply Balanced Quinoa Spinach Red Pepper Onion Chickpeas 10oz;    UPC: 85239058107    Target item number: 270-0-581,20180509,Class II,{},Target Corporation,F-1254-2018,Telephone,Food,79663,20180503.0,20180327,55402-3601,Voluntary: Firm initiated,Terminated,3
United States,Bayamon,"Calle 305, Building D-4","Undeclared allergens: wheat, soy, and milk.",,TBD,TBD,20180206,P.R. consignees only.,PR,Pound Cake NET WT 4OZ and 12OZ.,20180214,Class I,{},"Productos Pacheco, Inc.",F-0765-2018,Telephone,Food,78924,20190919.0,20180102,00959,Voluntary: Firm initiated,Terminated,5
United States,Goldsboro,1002B Sunburst Dr,Listeria monocytogenes,,,See product description for lot numbers,20150126,"NC, NJ & SC",NC,"Sausage, Egg & Cheese Croissant, Net Wt. 5.00 oz., UPC 7-01248-00523-8, MFG Code 623",20150204,Class I,{},"SunBurst Foods, Inc.",F-0852-2015,"Two or more of the following: Email, Fax, Letter, Press Release, Telephone, Visit",Food,69555,20150618.0,20141010,27534-8667,Voluntary: Firm initiated,Terminated,5
United States,Nottingham,20 Herr Dr,Herr Foods Inc. has initiated a voluntary recall of certain bags of its 1.875 oz. Sour Cream and Onion flavored Potato Chips due to a packaging error that incorrectly states that the product is gluten free.     While the back panel of the package complies with U.S. Food & Drug Administration (FDA) label regulations by listing Wheat in the ingredient statement as well as Contains Wheat in its,P.O. Box 300,"231,120",UPC No.  7260000061 for all the following Lot Numbers:  Jan 2 2016D  Jan 9 2016B  A Jan 9 2016  C Jan 9 2016  Jan 16 2016 A  Jan 16 2016 B  Jan 16 2016 E  D Jan 23 2016  Jan 23 2016 A  Jan 23 2016 C  Jan 30 2016 C,20151118,"VA, IL, FL, OH, MN, SC, GA, TX, AL, MO, NC, PA, VT, NY, CT, MA, MS, CA, WV, TN, AL, KY",PA,Herr's Sour Cream & Onion Flavored Potato Chips,20151125,Class II,{},Herrs Foods Inc,F-0187-2016,Letter,Food,72516,20161201.0,20151027,19362-9788,Voluntary: Firm initiated,Terminated,3
United States,Minneapolis,33 S 6th St,Shipping container from CA to HI was not held at proper temperature which could cause food items to be contaminated with spoilage organisms or pathogens,,2652 retail units total,"All product purchased at  Target store T2780, Honolulu, HI from March 23 through March 27, 2018.",20180503,HI,MN,CW ULTIMATE SOUTHWEST VEG 14OZ    UPC: 70332002881    Target item number: 270-0-4,20180509,Class II,{},Target Corporation,F-1356-2018,Telephone,Food,79663,20180503.0,20180327,55402-3601,Voluntary: Firm initiated,Terminated,3
United States,Chicago,2501 N Keeler Ave,Product may contain undeclared milk.,,"22,850 lbs",Product #B86036; Lot #WN012517D;  WN010617D;  WN022017D;  WN122216D,20170817,"Nationwide, Mexico, Canada",IL,"B86036, BATTER MX X1*, NET WT 50 LBS, Manufactured By: Newly Weds Foods, Inc., Chicago, IL 60639",20170726,Class II,{},Newly Weds Foods Inc,F-3299-2017,Letter,Food,77194,20190805.0,20170503,60639-2131,Voluntary: Firm initiated,Terminated,3
United States,Chicago,2501 N Keeler Ave,Product may contain undeclared milk.,,"9,500 lbs",Product #A85729; Lot #WN040617E,20170817,"Nationwide, Mexico, Canada",IL,"A85729, BATTER MX X1@, NET WT 1900 LBS, Manufactured By: Newly Weds Foods, Inc., Chicago, IL 60639",20170726,Class II,{},Newly Weds Foods Inc,F-3101-2017,Letter,Food,77194,20190805.0,20170503,60639-2131,Voluntary: Firm initiated,Terminated,3
United States,Minneapolis,33 S 6th St,Shipping container from CA to HI was not held at proper temperature which could cause food items to be contaminated with spoilage organisms or pathogens,,2652 retail units total,"All product purchased at  Target store T2780, Honolulu, HI from March 23 through March 27, 2018.",20180503,HI,MN,2-ct. (9-oz.) Hot Pockets X Four Cheese Pizza    UPC: 43695071092    Target item number: 270-6-190,20180509,Class II,{},Target Corporation,F-1220-2018,Telephone,Food,79663,20180503.0,20180327,55402-3601,Voluntary: Firm initiated,Terminated,3
United States,Norway,3021 78th St,Product may be contaminated with Salmonella.,,1374 canisters,lot 4290 use by Oct 2017,20150602,"Product was distributed nationwide, as well as to Puerto Rico and The Virgin Islands.  Foreign distribution was made to Canada.  There was also military distribution.",IA,"Frontier Natural Products Co-Op Organic Mama Garlic packaged in a cardboard canister with paper label Net  Wt. 5 oz (141 g), UPC 0 89836 18506 8.  The responsible name on the package is Frontier Norway, IA.",20150610,Class I,{},Frontier Natural Products Co-op,F-2370-2015,Press Release,Food,70726,20170330.0,20150316,52318-9520,Voluntary: Firm initiated,Terminated,5
United States,Windermere,4757 The Grove Dr,"Ready to Eat salad products containing iceberg lettuce, red cabbage and/or carrot ingredients are recalled due to a possible health risk from Cyclospora.",,unknown,"Product Code Z160, Z163, Z164. USED BY  or Before 7/12/2020",20200804,"Domestic: Midwestern states of AR, CT, DC, DE, IA, IL, IN, KS, KY, MA, MD, ME, MI, MN, MO, MT, NC, ND, NE, NH, NJ, NY, OH, OK, PA, RI, SD, TN, VA, VT, WI, WV  Foreign: Canada",FL,"Fresh Express Chopped Kit Thai 'N' Cashews 11.7 oz, UPC 071279309248, (Canada UPC) 0 71279 30925 5, Green and red cabbage, green leaf lettuce, carrots & green onions",20200722,Class II,{},Fresh Express Incorporated,F-1062-2020,E-Mail,Food,85918,20201216.0,20200619,34786-8426,Voluntary: Firm initiated,Terminated,3
United States,Forsyth,10203 State Highway 76,Firm is recalling dietary supplements containing a raw material which may contain >0.3 ppb chloramphenicol,,"835,013 bulk capsules","Lot #'s: 92103002, 92103004, 92103005, 92103006, 92103007, and 92103008",20131213,"Domestic distribution of the product is nationwide with direct accounts in 27 states in all geographical regions. Foreign distribution consists of direct accounts in the following countries: Canada, China, Malaysia, Norway, Slovakia, South Korea, Sweden, Taiwan, and the United Kingdom.",MO,"Bulk 9730 BIOSANLABS GLUTENEZYME capsules, packaged in poly bags in corrugated boxes (for domestic distribution) or fiber drums (for international distribution) (SKU 92103).",20131225,Class II,{},National Enzyme Co,F-0767-2014,"Two or more of the following: Email, Fax, Letter, Press Release, Telephone, Visit",Food,66658,20150303.0,20131030,65653-5445,Voluntary: Firm initiated,Terminated,3
United States,Milwaukee,726 S 12th St.,"Recalled salads, slaw, salsa, bean and dips contained onions that were recalled by Gills Onions due to potential Listeria monocytogenes contamination.",,756 LBS,Product Code 4025 with Date codes 8/14/2012-8/17/2012,20120907,AZ  CA  FL  IA  IL  IN  MA  MI  MN  MO  OH  PA  TX  WI,WI,"Acme Creamed Cabbage, Net Wt. 16 oz., UPC 0 11596 14025 1",20120919,Class I,{},"Garden-Fresh Foods, Inc.",F-2171-2012,Letter,Food,62707,20121115.0,20120727,53204-1211,Voluntary: Firm Initiated,Terminated,5
United States,Portsmouth,1 Highliner Ave,Product may contain undeclared milk.,,"693,408 cases (total for all products)",Lot Number: 0027049181,20170815,Nationwide,NH,"Southern Home 12/24oz Breaded Minced Fish Sticks,  Item Number: B1133",20170823,Class II,{},High Liner Foods Inc.,F-2656-2017,"Two or more of the following: Email, Fax, Letter, Press Release, Telephone, Visit",Food,77489,20171214.0,20170609,03801-4146,Voluntary: Firm initiated,Terminated,3
United States,Seattle,4721 California Ave Sw,"Blackberry Cheesecake Husky ice cream is being recalled due to the potential to be contaminated with Listeria monocytogenes. This product contains an ice cream mix ingredient manufactured and recalled by Snoqualmie Gourmet Ice Cream, Inc.",,,Production date is hand-written on 2.5 gallon bulk containers.,20150205,Product was distributed in Washington.,WA,"Blackberry Cheesecake ice cream is packed in 2.5 gallon bulk, 1.5 gallon bulk, or half gallon retail size tubs.  Retail size ice cream flavor is labeled in part, ""***Husky Ice Cream, Inc. 4721 California Ave SW Seattle, WA 98116  HUSKY ""Cream of the Town"" HALF GALLON ICE CREAM www.huskydeli.com INGREDIENTS: CREAM, MILK, SKIM MILK POWDER, SUGAR, CORN SYRUP SOLIDS, CAROB BEAN GUM, GUAR GUM, SOY LECITHIN, CARRAGEENAN"".     No UPC code.",20150211,Class I,{},"Husky Ice Cream,Inc",F-0983-2015,Telephone,Food,70154,20150323.0,20141224,98116-4412,Voluntary: Firm initiated,Terminated,5
United States,Chicago,2501 N Keeler Ave,Product may contain undeclared milk.,,"2,650 lbs",Product #A81911; Lot #WN012817D,20170817,"Nationwide, Mexico, Canada",IL,"A81911, BATTER MX X1*, NET WT 50 LBS, Manufactured By: Newly Weds Foods, Inc., Chicago, IL 60639",20170726,Class II,{},Newly Weds Foods Inc,F-3075-2017,Letter,Food,77194,20190805.0,20170503,60639-2131,Voluntary: Firm initiated,Terminated,3
United States,Portales,42593 US Highway 70,"Sunland, Inc. is conducting a voluntary limited recall of its Almond, Peanut, and Cashew Butter products and Tahini and Roasted Blanched Peanut Products, manufactured between May 1, 2010 and September 24, 2012, because these products may be contaminated with Salmonella.",,148 x 16 oz; 93 x 500 g,"Best-If-Used-By Dates between March 1, 2011 and September 24, 2013.",20121023,National distribution under various brand names including all 50 U.S. States with some international distribution Hong Kong.,NM,"Sunland Organic Creamy Valencia Peanut Butter, 16 oz, UPC 048687329700;   500 g, UPC 48687328093.",20121031,Class I,{},"Sunland, Incorporated",F-0482-2013,Press Release,Food,63257,20141001.0,20120924,88130-9043,Voluntary: Firm initiated,Terminated,5
United States,Santa Fe Springs,13409 Orden Dr,"Fish Cake items contain possible contaminating undeclared egg, milk and shellfish.",,"26,433 packages",Item number #92555,20190807,"AK, AL, AR, AZ, CA, CO, CT, DC, FL, GA, HI, IL, IN, KS, KY, LA, MA, MD, MI, MN, MO, MS, NC, NE, NJ, NV, NY, OH, OK, OR, PA, RI, SC, TN, TX, UT, VA, WA",CA,"Shirakiku FISH CAKE GOBO MAKI SK F:  20/ 150G, Net Wt. 5.29 oz.  Keep Frozen, 5 pcs.  UPC 07441092550    Distributed by Wismettac Asian Foods, Inc. Santa Fe Springs, CA",20190814,Class I,{},"Wismettac Asian Foods, INC",F-1976-2019,Letter,Food,83325,20200128.0,20190711,90670-6336,Voluntary: Firm initiated,Terminated,5
