country,city,address_1,reason_for_recall,address_2,product_quantity,code_info,center_classification_date,distribution_pattern,state,product_description,report_date,classification,openfda,recalling_firm,recall_number,initial_firm_notification,product_type,event_id,more_code_info,recall_initiation_date,postal_code,voluntary_mandated,status,severity_score
United States,Chicago,2501 N Keeler Ave,Product may contain undeclared milk.,,"5,100 lbs",Product #B21085; Lot #WN010317D,20170817,"Nationwide, Mexico, Canada",IL,"B21085, BATTER MIX, NET WT 50 LBS, Manufactured By: Newly Weds Foods, Inc., Chicago, IL 60639",20170726,Class II,{},Newly Weds Foods Inc,F-3154-2017,Letter,Food,77194,20190805.0,20170503,60639-2131,Voluntary: Firm initiated,Terminated,3
United States,Bells,#10  Pictsweet Drive,Products contain onions which were recalled for the possibility of Listeria monocytogenes contamination.,,79932 units,"969 cases of 8 units:   Best if Used by 3/28/2018: 0886KH,0886KQ,0886KR,0886KR,0886KR,0886KT;  Best if Used by 4/5/2018: 0966KB,0966KD,0966KE,0966KJ    6015 Cases of 12 units:  Best if Used by 3/19/2018:  0796KD,0796KE,0796KF,0796KG,0796KJ,0796KK,0796KL,0796KN,0796KP,  0796KQ,0796KR,0796KS,0796KT,0796KU,0796KV;",20160707,Nationwide,TN,"PICTSWEET(R) Steamables, Seasoned Spring Vegetables, with Asparagus and Ground Peppercorn Seasoning, NET WT 10 OZ (283g), UPC 70560 97826, DISTRIBUTED BY THE PICTSWEET COMPANY, BELLS, TN 38006",20160713,Class I,{},The Pictsweet Company,F-1659-2016,E-Mail,Food,73853,20170803.0,20160409,38006,Voluntary: Firm initiated,Terminated,5
United States,College Park,2225 Riverdale Rd,The firm determined that the food was not held at an appropriate temperature. Because of the time-temperature relationship of the environment this food could be unsafe to consume.,,23cs/6/1/lb Plastic container,All lot codes shipped between 7/14/2021 and 8/13/2021,20210920,"Product was shipped to the following states: GA, NC & TN.",GA,"MINOR'S SEAFOOD BASE NO MSG GF 6/16 OZ (1 lb) 453 G UNITS Plastic container (pint) gluten free DISTRIBUTED BY NESTLE PROFESSIONAL NORTH AMERIC, SOLON, OH 44139",20210929,Class II,{},"Sysco Atlanta, LLC",F-1000-2021,Letter,Food,88509,,20210813,30337-5111,Voluntary: Firm initiated,Completed,3
United States,Boston,18 Food Mart Rd,Products recalled due to undeclared allergen -milk,,"1,055,006 pounds (total distributed for all product)",23502,20170725,"FL, MA, IL, IN, AL, SC, NC, RI, PA, MD, NY, NH, NV, WI",MA,Channel Brand - Raw Breaded Bay Scallops - Net wt/ 10lb. (4.54 KG),20170802,Class III,{},Channel Fish Processing Co. Inc,F-2924-2017,"Two or more of the following: Email, Fax, Letter, Press Release, Telephone, Visit",Food,77570,20170912.0,20170613,02118-2802,Voluntary: Firm initiated,Terminated,1
United States,Manchester,231 Woodland Ave,Product may be contaminated with Listeria monocytogenes.,,8 oz 176393; 16 oz 5268; 2lb 496; 5lb 1482; 12oz 1373; 7 oz 6160; 14 oz 4075 (total for all products),All lots within expiry.,20171212,NY and NJ,NH,"Yorgo's Foods THREE BEAN SALAD NET WT. 5 LBS 80 oz (2268g) UPC: 7 56248 10071 1 and Yorgo's THREE BEAN SALAD NET WT. 12 OZ (340g) UPC: 7 56248 10063 6. Product is packaged in a clear plastic container, keep refrigerated.",20171206,Class I,{},Yorgo Food's Inc.,F-0474-2018,Telephone,Food,78523,20180713.0,20171110,03109-4457,Voluntary: Firm initiated,Terminated,5
United States,Sterling,21592 Atlantic Blvd Ste 130B,The USFDA alerted firm during current inspection that a sample collected by agency had tested positive for Salmonella .  The firm decided to recall the product .,,4708.32 lbs,"4040615  Net Wt: 7oz (200gm)  , Net Wt: 28oz (800gm)    4051315  Net Wt: 400 gms (14oz) , Net Wt: 5lb",20151105,"Products were distributed in area of USA only in states of Virginia, Maryland & North Carlina since December 2014. Accounts were Food service & retail grocery stores. There were no US Government accounts.",VA,"AKSAR  (life taste and beyond)  Cashew Pieces     4040615  Net Wt: 7oz (200gm)  , Net Wt: 28oz (800gm)    4051315  Net Wt: 400 gms (14oz) , Net Wt: 5lb    20 NEWLAND COURT, STERLING, VA 20165  Phone # 703-880-9802 , FAX # 703-880-1602",20151111,Class I,{},Aksar LLC,F-0135-2016,E-Mail,Food,71309,20160111.0,20150520,20166-6858,Voluntary: Firm initiated,Terminated,5
United States,Le Mars,1 Blue Bunny Dr SW,Product may be contaminated with Listeria Monocytogenes.,PO Box 1310,7192 cases,UPC 070640014644  LOT 60001 MM 19115 6228  BEST IF USED BY 02/13/18; and    UPC 070640014651  (High altitude)  LOT 60001 MM 19115 6229  BEST IF USED BY 02/14/18,20161118,"Product was distributed to NE, OK, KS, MO, AZ, and TX.",IA,Blue Bunny Ice Cream Hoppin' Holidoodle ice cream 46 fl. oz. UPC 070640014644 and UPC 070640014651 (high altitude).,20161130,Class I,{},"Wells Enterprises, Inc.",F-0479-2017,"Two or more of the following: Email, Fax, Letter, Press Release, Telephone, Visit",Food,75405,20170105.0,20161010,51031-2207,Voluntary: Firm initiated,Terminated,5
United States,Chipley,1061 Commerce Ave,Due to high levels of aflatoxin,,"6,084 bags","UPC #70582-10001  Lot # ""Sell By 2-21-14""  Exp date 2-21-14",20130628,Alabama,FL,ARNETT'S PLAIN CORN MEAL NET WT. 24 OZ. (1lb. 8 oz)(680g,20130710,Class II,{},"Hoover Mill, Inc.",F-1578-2013,E-Mail,Food,65446,20130703.0,20130410,32428-6395,Voluntary: Firm initiated,Terminated,3
United States,Windermere,4757 The Grove Dr,"Ready to Eat salad products containing iceberg lettuce, red cabbage and/or carrot ingredients are recalled due to a possible health risk from Cyclospora.",,unknown,"Product Code, Z160, Z162, Z164,  Z172, Z174, Z176. USED BY or Before 7/11/2020",20200804,"Domestic: Midwestern states of AR, CT, DC, DE, IA, IL, IN, KS, KY, MA, MD, ME, MI, MN, MO, MT, NC, ND, NE, NH, NJ, NY, OH, OK, PA, RI, SD, TN, VA, VT, WI, WV  Foreign: Canada",FL,"Fresh Express Gourmet Cafe Creative Classics Turkey & Bacon Chef 5.75 oz.,UPC 071279407081,  Iceberg & romaine lettuce, carrots & red cabbage",20200722,Class II,{},Fresh Express Incorporated,F-1068-2020,E-Mail,Food,85918,20201216.0,20200619,34786-8426,Voluntary: Firm initiated,Terminated,3
United States,Berkeley,1609 4th St,Firm was notified by L-Leucine supplier that product may contain cyclamates. Testing of the product confirmed this and a recall was initiated.,,"22, 848, 401 (A ll-Domestically)",All lots,20180731,worldwide distribution,CA,"GU Energy Gels:  Caramel Macchiato, Gel;  GUGEL 1 Pkt; item # 123031, UPC 769493200518;  GUGEL 24Pkt Box; item number 123056, UPC 769493200525",20180808,Class III,{},Advanced Food Concepts,F-1684-2018,Letter,Food,80591,20191114.0,20180718,94710-1708,Voluntary: Firm initiated,Terminated,1
United States,Milton,147 Industrial Park Rd,Product may contain foreign material.,Po Box 2109,"18,632 cans","Lot Codes: T16DTKC, T17DTJC, T20DTDC",20190213,AL  AR  AZ  CA  CO  CT  DE  FL  GA  IA  IL  IN  KS  KY  LA  MI  MN  MO  MS  NC  NH  NY  OH  OR  PA  TN  TX  UT  VA  WI,VT,"Parent's Choice Toddler Next Stage¿ Milk Drink Powder Natural Milk Flavor With Other Natural Flavors, Stage 3, 1 Year and Up, NET WT 24 OZ (1.5 LB) 680g, UPC: 0 78742 06717 9 and Little JOURNEY Toddler Next Stage MILK DRINK POWDER, NET WT I PESO NETO 24 OZ I ONZAS (1.5 LB) 680g.",20190220,Class II,{},"PBM Nutritionals, LLC",F-0904-2019,Letter,Food,81985,20190529.0,20190121,05468-2109,FDA Mandated,Terminated,3
United States,Nampa,62 6th St N,Mitragyna Speciosa Leaf Powder Green Horn Kratom product is  being recalled because they have the potential to be contaminated with Salmonella,,350 packages,Recalled product has any of the following LOT Numbers:    RVS1380182301;  RVB1380182201;  GVH1380171512;  MD13120181601.,20180518,Nationwide through internet sales,ID,"Mitragyna Speciosa Leaf Powder-GREEN Horn, sold under the brand name Herbal-Salvation.com.  The powder is packaged in kraft paper, foil-lined heat sealed pouches and sold in 25g, 100g, 250g, and 1000g.      The product label is read in parts: ""***herbal-salvation***Mitragyna Speciosa Leaf Powder Green Horn***Origin: Indonesia***Disclaimer: This product is sold as a bulk botanical without directions or claims.  Keep away from children***2204 Cortland Place, Nampa, ID 83678***WWW.HERBAL-SALVATION.COM***"".",20180509,Class I,{},"Viable Solutions, LLC",F-1477-2018,Press Release,Food,79836,20181116.0,20180418,83687-3485,Voluntary: Firm initiated,Terminated,5
United States,San Fernando,13023 Arroyo St,Karoun Dairies is recalling all cheese manufactured from an identified manufacturer due to potential Listeria monocytogenes contamination.,,1.6 million lbs (total all cheese),Use by dates up to:  1/2/2016,20151021,U.S. distribution nationwide.  Foreign distribution to the following; Canada and Malaysia,CA,"Mozzarella   Natural Hickory Smoked  Net Wt. 1lb.    UPC Codes:  7 96252 70012 5, 7 96252 70013 2, 7 96252 12014 5,  7 96252 12015 2    Product is vacuum packed.",20151028,Class I,{},Karoun Dairies,F-0087-2016,"Two or more of the following: Email, Fax, Letter, Press Release, Telephone, Visit",Food,72213,20160412.0,20150916,91340-1540,Voluntary: Firm initiated,Terminated,5
United States,Millersburg,6575 Township Road 351,The firm was notified by their supplier that various cheese products they received were contaminated by Listeria monocytogenes.,,2 Baskets,All purchased 9/1/16  2/15/17,20170416,"Producct was shipped to the following states: AR, FL, GA, IA, IN, KS, KY, MD, MN, MO, NC, NE, NY, OH, PA, SC, TN, VA, VT, WI & WV.",OH,Holiday Crowd Pleaser Basket Containing packages Guggisberg Marble Cheese.,20170426,Class I,{},Dutch Valley Food Distributors,F-1974-2017,Letter,Food,76505,20180215.0,20170216,44654-9055,Voluntary: Firm initiated,Terminated,5
United States,Cranford,125 Moen St,Pine nuts may contain peanuts,,870 lbs.,Lot 97368,20121009,Nationwide,NJ,"Organic Pine Nuts (Raw, No Shell)  1 lb.Nuts.com  NutsOnline, 125 Moen Street, Cranford, NJ 07016 800-558-8881",20121017,Class I,{},"Newark Nut Stores, Inc.",F-0028-2013,E-Mail,Food,63164,20150611.0,20120821,07016-3518,Voluntary: Firm initiated,Terminated,5
United States,Pittsburgh,101 Kappa Dr,Giant Eagle discovered that the scale label fails to declare the milk ingredient. The allergen statement does not declare the milk allergen.,,288 units,All date codes,20160531,"IN, OH, MD, PA, WV",PA,"Walnut Delights 6 Pack  Net Weight: 9 oz.  PLU #69690  UPC: 2 69690 20399 7  Giant Eagle, LLC, Pittsburgh, PA",20160608,Class I,{},"Giant Eagle, Inc.",F-1408-2016,E-Mail,Food,73975,20161212.0,20160428,15238-2809,Voluntary: Firm initiated,Terminated,5
United States,Lewistown,19 Susquehanna Ave,Product has the potential to be contaminated with Salmonella.,,65 units,Lot #'s: 000337412; 000335555;,20170419,AL; AR; CA	; CO; CT; DC; DE; FL; GA; IL; IN; KY; LA ; MA ; MD ME; MI; MN; MO; MT; NC; ND; NH; NJ; NM; NY; OH; OK; OR; PA ; RI ; SC; SD; TN; TX; VA; VT; WA; WI; WV; WY,PA,Asher's Chocolate Co. Milk Chocolate (09661) Peanut Butter Caramel Cup 2.25 oz.; 24 piece box.;,20170426,Class II,{},"Ashers Chocolates/Lewistown, Inc.",F-2042-2017,"Two or more of the following: Email, Fax, Letter, Press Release, Telephone, Visit",Food,75098,20170817.0,20160902,17044-2332,Voluntary: Firm initiated,Terminated,3
United States,San Luis Obispo,184 Suburban Rd,Potential Salmonella contamination.,,"45,498 Bottles Total",Lot Number: 20220C  Best By Date: Aug-22,20201022,nationwide and on line sales,CA,The Spice Hunter  Pumpkin Pie Spice   1.8 oz.    Jar UPC 8105701850  Case UPC 40081057018505,20201028,Class I,{},Sauer Brands Inc - SLO,F-0044-2021,Letter,Food,86594,20210218.0,20201009,93401-7502,Voluntary: Firm initiated,Terminated,5
United States,San Antonio,1011 S Acme Rd,Product may contain undeclared peanuts.,,768 units,Lot # 218BZ4A,20150331,"TX, LA, TN, AZ, IA",TX,"Maria's Picante Sauce NEt WT. 12 OZ. (342g) Distributed by Maria's Mexican Restaurante Bogalusa, LA 70427",20150408,Class II,{},"Creative Foodworks, Inc",F-1835-2015,Telephone,Food,70429,20150821.0,20150202,78237-3218,Voluntary: Firm initiated,Terminated,3
United States,Swedesboro,2339 Center Square Rd,The products are contaminated with Listeria monocytogenes.,,7887 cases,"1) Wawa baby carrots Net Wt 3 oz (85g) Distributed by: Wawa, Inc. Wawa, PA 19063 wawa.com  On or before August 16; UPC 2619102517",20120911,"Alabama, Arkansas, Connecticut, Delaware, DC, Florida, Georgia, Florida, Iowa, Illinois, Indiana, Kentucky, Louisiana, Maine, Maryland, Massachusetts, Michigan, Minnesota, Missouri, Mississippi, Montana, Nebraska, New Hampshire, New Jersey, New York, North Carolina, North Dakota, Ohio, Oklahoma, Pennsylvania, Rhode Island, South Carlina, South Dakota, Tennessee, Vermont, Virginia, Wisconsin, and West Virginia.",NJ,"Wawa baby carrots Net Wt 3 oz (85g) Distributed by: Wawa, Inc. Wawa, PA 19063 wawa.com  On or before August 16; UPC 2619102517",20120919,Class I,{},"Missa Bay, LLC",F-2282-2012,Letter,Food,62794,20130528.0,20120808,08085-1700,Voluntary: Firm Initiated,Terminated,5
United States,Carol Stream,285 Fullerton Ave,"This recall has been identified due to the detection of cyclamates (artificial sweetener). Use of or consumption of cyclamates may include potential health hazard. Cyclamates and its salts (such as calcium cyclamate, sodium cyclamate, magnesium cyclamate, and potassium cyclamate) are currently prohibited from use in the United States.",,3000 kgs,526606702  608042  601013,20180720,"CA, IL, NV, PA, TN, TX, UT",IL,Prinova brand  Product - Reginator NV (41825)  25 Kgs Fiber carton double layer polyethylene bag as liner,20180801,Class III,{},Prinova US LLC,F-1660-2018,E-Mail,Food,80358,20190515.0,20180622,60188-1886,Voluntary: Firm initiated,Terminated,1
United States,Beloit,3400 Millington Rd,Product contains foreign material (nylon string),,104 bags,0626987104,20190813,"Distributed to manufacturers and food service distributors in the following US states: AL, AR, CA FL, GA, MO, OH, OK, TX, and WI.",WI,"Predust/Batter, Item Number 30753195.49, Net Wt. 50 lb, Distributed by Kerry Ingredients & Flavours, Beloit, WI",20190821,Class II,{},"Kerry, Inc",F-2019-2019,"Two or more of the following: Email, Fax, Letter, Press Release, Telephone, Visit",Food,83498,20200206.0,20190729,53511-9554,Voluntary: Firm initiated,Terminated,3
United States,Tigard,16285 Sw 85th Ave Ste 101,Bridge City Baking is recalling three frozen ready to bake pies due to undeclared milk.  Butter is declared without the sub-ingredient milk.,"Tigard, Or",88 cases (8 units per case),"BEST BY 04 15 through 10 15.  This represents April - October, 2015.",20150519,"Product was distributed in Alaska, Idaho, Oregon, and Washington",OR,BRIDGE CITY Baking gluten free Marionberry Crumble Pie.  This product is frozen ready to bake.  Net Wt 24oz    UPC 0 91037 54454 4,20150527,Class II,{},Bridge City Baking LLC,F-2310-2015,Telephone,Food,70984,20151229.0,20150410,97224-5421,Voluntary: Firm initiated,Terminated,3
United States,White Plains,100 Hillside Ave,The recalled products may potentially contain metal fragment(s) from a faulty manufacturing part.,,662 cases / 6 / 4x4 oz cups,UPC 36632 00427 Expiration code of NOV 25 2012 MZ,20130320,"The product was distributed nationwide including the states of: FL, GA, IL, IN, KY, MD, ME, MI, NC, NY, OH, PA, SC, VA, WI.",NY,Dannon Light & Fit Carb & Sugar Control Cultured Dairy Snack Vanilla Flavor 4x4oz cups,20130327,Class II,{},"The Dannon Company, Inc - Discovery & Innovation Center",F-1242-2013,"Two or more of the following: Email, Fax, Letter, Press Release, Telephone, Visit",Food,63529,20130821.0,20121023,10603-2861,Voluntary: Firm initiated,Terminated,3
United States,Forest Park,16 Forest Pkwy,Product may be contaminated with Listeria monocytogenes.,Bldg H,3425 cases,Julian Date 12188 through Julian Date 12206 - Item No. 501200,20120822,"AL, GA, NC, SC &  TN.",GA,Processed Yellow Onions - Yellow Slivered,20120829,Class I,{},"Freshpoint Atlanta, Inc.",F-1981-2012,"Two or more of the following: Email, Fax, Letter, Press Release, Telephone, Visit",Food,62685,20121214.0,20120725,30297-2015,Voluntary: Firm initiated,Terminated,5
United States,Arlington,1812 N Moore St,Potential presence of food-grade rubber pieces.,,"1,322,591 cases (total all products)","BATCH CODE(S): 9190, 9230, 9236, 9237, 9270, 9273    Batch Code date Breakdown: YDDD Y-Year (2019)  JJJ: Julian date (189)",20200109,All consignees are in the US,VA,"Nestle Toll House Peanut Butter Chocolate Chip Bar (16oz), UPC 050000622634",20200115,Class II,{},Gerber Products Company dba Nestle Infant Nutrition,F-0487-2020,"Two or more of the following: Email, Fax, Letter, Press Release, Telephone, Visit",Food,84172,20200618.0,20191030,22209-1815,Voluntary: Firm initiated,Terminated,3
United States,Wellington,12155 NCR 15,Eggs have the potential to be contaminated with Salmonella Enteritidis,,220,"Expiration date of 5/18/14, 5/19/14, 5/22/14, or 5/23/14;  location code of 1 or 3",20140715,"Product was distributed in Colorado; some may have gone to Idaho, Kansas, New Mexico, and Utah. No military/govt/VA or foreign consignees.",CO,"Certified Organic, Owl Canyon Whole Eggs, packed in one dozen and half-dozen cardstock packages, with a packing date of 93, 94, 97, or 98.",20140723,Class I,{},"Six Dog, LLC",F-2176-2014,Press Release,Food,68189,20140812.0,20140505,80549,Voluntary: Firm initiated,Terminated,5
United States,Miami,7345 SW 45th St,"Pursuant to a consent decree that prohibits the company and its owners for marketing dietary supplements until they, among other things, recall and destroy the dietary supplements that have been manufactured or distributed since April 2, 2014, hire a cGMP expert and receive written permission from FDA to resume operations.",,"1,444,900 capsules","As persuant to the Consent Decree, the firm agreed to ""recall and destroy, under FDA's supervision, in accordance with the procedures provided in paragraph 6, ALL dietary supplements that were manufactured, prepared, processed, packed, labeled, held and/or distributed between April 2, 2014 and the date of entry of this Decree.""  The Decree was entered on September 25, 2015.    Known lots and expiration dates: Lot # 140714 Exp. Date 08/17, Lot # 310914 Exp. Date 10/17, Lot # 560914 Exp. Date 10/17, Lot # 271214 Exp. Date 12/17, Lot # 070115 Exp. Date 01/18, Lot # 460315 Exp. Date 04/18, Lot # 080615 Exp. Date 08/18",20161228,"Products distributed to Florida, Nevada and the Dominican Republic",FL,"DHEA 25 mg, bulk capsules",20170104,Class II,{},Sunset Natural Products Inc.,F-0994-2017,Letter,Food,74054,20170410.0,20151013,33155-4509,FDA Mandated,Terminated,3
United States,Austin,550 Bowie St,The product has the potential to be contaminated with Listeria monocytogenes.,,Unknown,"Sold between June 1 and July 21, 2014 at Whole Foods Stores",20141209,"All states where Whole Foods Market stores are located except Florida, Washington, and Oregon.",TX,"Whole Foods Market 4"" fresh fruit tart decorated with plums, UPC/PLU 0201189005002; Whole Foods Market 6"" fresh fruit tart decorated with plums, UPC/PLU 0201898022000; Whole Foods Market 9"" fresh fruit tart decorated with plums, UPC/PLU 0201897029000",20141217,Class II,{},Whole Foods Market,F-0699-2015,Press Release,Food,68897,20150519.0,20140723,78703-4648,Voluntary: Firm initiated,Terminated,3
United States,Miami,7345 SW 45th St,"Pursuant to a consent decree that prohibits the company and its owners for marketing dietary supplements until they, among other things, recall and destroy the dietary supplements that have been manufactured or distributed since April 2, 2014, hire a cGMP expert and receive written permission from FDA to resume operations.",,Unknown,"As persuant to the Consent Decree, the firm agreed to ""recall and destroy, under FDA's supervision, in accordance with the procedures provided in paragraph 6, ALL dietary supplements that were manufactured, prepared, processed, packed, labeled, held and/or distributed between April 2, 2014 and the date of entry of this Decree.""  The Decree was entered on September 25, 2015.    Known lot: Lot # 440914",20161228,"Products distributed to Florida, Nevada and the Dominican Republic",FL,Oyster Dietary Supplement (unknown container size),20170104,Class II,{},Sunset Natural Products Inc.,F-1033-2017,Letter,Food,74054,20170410.0,20151013,33155-4509,FDA Mandated,Terminated,3
United States,Portsmouth,1 Highliner Ave,Product may contain undeclared milk.,,"693,408 cases (total for all products)",Lot Number:  0027031110,20170815,Nationwide,NH,"Fisherman's Reserve 12/1lb Breaded Haddock Fillets,  Item Number: B1378",20170823,Class II,{},High Liner Foods Inc.,F-2665-2017,"Two or more of the following: Email, Fax, Letter, Press Release, Telephone, Visit",Food,77489,20171214.0,20170609,03801-4146,Voluntary: Firm initiated,Terminated,3
United States,New York,211 E 48th St,Product may be contaminated with Salmonella.,,,UPC: 5706200452 (4oz) and 5706200491 (8oz)  Best By Dates through 7/29/2021,20210827,"IL, WI, IA, IN, MI",NY,"BrightFarms Mighty Romaine; packaged in clear, plastic clamshells; 4oz and 8oz; grown at the company's Rochelle, Illinois indoor farm",20210908,Class I,{},Bright Farms,F-0896-2021,Telephone,Food,88290,20211005.0,20210715,10017-1538,Voluntary: Firm initiated,Terminated,5
United States,Westfield,53 Summit Lock Road,Products were not held at an appropriate temperature due to a mechanical malfunction during transportation.,53 Medieros Way,unknown,"Exact codes are unknown. The product being recalled was sold on June 17, 2019 at Target Stores in Commack, NY and Central Islip, NY.",20190724,"Two Target Stores 1. 98 Veterans Memorial Highway in Commack, New York 2. 160 North Research Place in Central Islip, New York",MA,FAT FREE HALF & HALF - 0.5GAL - MARKET PANTRY;  UPC: 8523961640,20190731,Class II,{},"C & S Wholesale Grocers, Inc.",F-1748-2019,Telephone,Food,83178,20190731.0,20190617,01085-9777,Voluntary: Firm initiated,Terminated,3
United States,Northfield,3 Lakes Dr,Possible presence of glass fragments in CapriSun and Kool-Aid Jammers.,,"20, 298 cases, 4 boxes/case, 10 drinks/box.",best when used by code date: 11 DEC 2016 Gr02CT762 and 12 DEC 2016 GR02CT762.,20160520,The firm distributed the product to 132 domestic firms. Please see the attached spreadsheet for a list of all consignees.,IL,Kool-Aid Jammers Tropical Punch packaged in a red blue and purple box with white lettering.,20160601,Class II,{},Kraft Heinz Foods,F-1396-2016,Letter,Food,72950,20180221.0,20151229,60093-2753,Voluntary: Firm initiated,Terminated,3
United States,San Antonio,646 S Flores St,May contain broken metal pieces,,"12,906 units",UPC 4122083895; Best if used by: 11/28/2018,20180613,Texas and Mexico,TX,HEB Creamy Creations No Sugar Added Orange Sherbet quart,20180620,Class II,{},H-E-B GROCERY COMPANY LP DBA HEB,F-1560-2018,"Two or more of the following: Email, Fax, Letter, Press Release, Telephone, Visit",Food,80210,20180904.0,20180530,78204,Voluntary: Firm initiated,Terminated,3
United States,Fairfield,10 Washington Ave,"Command Nutritionals LLC is recalling Hard Blast-Pink Lemonade and Juggernaut- Various flavors due to contaminated L-Citrulline which was received from Axel Chemicals, Brentwood, TN.",,1990 units,a) Crimson Punch - Lot #13086 - exp date 04/01/2015  b) Orange - Lot #13085 - exp date 04/01/2015  c) Raspberry Lemonade - Lot #13087 - exp date 01/01/2015,20140410,FL,NJ,"Juggernaut     a) Crimson Punch UPC 811020906803  b) Orange UPC  811020906841  c) Raspberry Lemonade UPC 811020906858    Net Wt. 1.76 lbs.   Manufactured in the USA Infinite Labs, LLC  PO Box 533736 Orlando, FL 32853  1-877-455-2271",20140416,Class II,{},"Command Nutritionals, LLC",F-1818-2014,"Two or more of the following: Email, Fax, Letter, Press Release, Telephone, Visit",Food,67842,20150428.0,20140311,07004-3843,Voluntary: Firm initiated,Terminated,3
United States,Moscow,1000 Wild Iris Ln,"Organic Thai Fusion Outpost 5.1 oz. packages, Organic Thai Fusion 3 lbs. bulk bags, and  Organic On the Go Thai Fusion 3.4 oz cups are recalled due to undeclared milk.",,15/5.1 oz. pouches of Outpost; 6/3.4 oz. cups of On the Go; and 12/3 lbs bags.,Lot # 021091  Lot # 022492  Product was made on 02/10/16 and 02/24/16.,20160328,"sold on  AK, AL, AZ, CA, FL, GA, ID, IN, MA, MN, NJ, NY, OR, UT, and WA and in Netherland. Products were sold from www.maryjanesfarm.org.",ID,"Thai Fusion Outpost, net weight 5.1 oz.  UPC 0 99853 34255 9.    Thai Fusion Bulk bag, packaged in a ziploc plastic bag, net weight 3 lbs. UPC 0 99853 35255 8.    Thai Fusion On the Go, packaged in microwave able paper cup with plastic lid, net wt. 3.4 oz. UPC 0 99853 38255 5.",20160406,Class I,{},Paradise Farm Organics Inc,F-0818-2016,Visit,Food,73558,20160818.0,20160317,83843,Voluntary: Firm initiated,Terminated,5
United States,Alsip,12200 S Central Ave,Potential presence of  Salmonella due to use of recalled whey ingredient,,"98 bags, 4,900 lbs",Batch or lot numbers:  673826  676245  676986,20180827,Nationwide and Canada,IL,Caesar Seasoning  50 pound bag   Item 1000031193,20180808,Class II,{},Griffith Labs U.S.A.,F-1884-2018,"Two or more of the following: Email, Fax, Letter, Press Release, Telephone, Visit",Food,80567,20200520.0,20180717,60803-3408,Voluntary: Firm initiated,Terminated,3
